{
  "schemaVersion": 1,
  "readiness": "INPUT_REQUIRED",
  "serviceId": "caddy",
  "exclusiveIngress": true,
  "serviceImagePath": "D:\\tools\\caddy\\caddy.exe",
  "serviceImageSha256": "0000000000000000000000000000000000000000000000000000000000000000",
  "serviceCommandLineSha256": "0000000000000000000000000000000000000000000000000000000000000000",
  "serviceEnvironmentSha256": "0000000000000000000000000000000000000000000000000000000000000000",
  "serviceAccount": "CONTOSO\\leantpm-proxy$",
  "serviceAccountSid": "S-1-5-21-111111111-222222222-333333333-4444",
  "startMode": "AUTO",
  "scmSddlSha256": "0000000000000000000000000000000000000000000000000000000000000000",
  "configPath": "D:\\LeanTPM\\Runtime\\proxy\\Caddyfile",
  "configSha256": "0000000000000000000000000000000000000000000000000000000000000000",
  "publicHost": "tpm.example.com",
  "webRoot": "D:\\LeanTPM\\App\\current\\payload\\web",
  "backendUpstream": "http://127.0.0.1:18080",
  "listenPorts": [80, 443],
  "tlsDataRoot": "D:\\LeanTPM\\Runtime\\proxy\\tls",
  "logRoot": "D:\\LeanTPM\\Runtime\\proxy\\logs",
  "adminEndpoint": "OFF",
  "firewallRuleGroup": "LeanTPM-Public-Isolation",
  "firewallPolicySha256": "0000000000000000000000000000000000000000000000000000000000000000"
}
